id,movie_key,name,source,file_name,script_url,tmdb_title,release_date,tmdb_id,overview,imdb_title,imdb_release_date,imdb_id,dialogue,charinfo,tagged
249,coriolanus,Coriolanus,imsdb,Coriolanus,https://imsdb.com/scripts/Coriolanus.html,Coriolanus,2011-02-14,101173,"Caius Martius, aka Coriolanus, is an arrogant and fearsome general who has built a career on protecting Rome from its enemies. Pushed by his ambitious mother to seek the position of consul, Coriolanus is at odds with the masses and unpopular with certain colleagues. When a riot results in his expulsion from Rome, Coriolanus seeks out his sworn enemy, Tullus Aufidius. Together, the pair vow to destroy the great city.",Coriolanus,2011,1372686,Coriolanus_dialogue.txt,Coriolanus_charinfo.txt,Coriolanus_parsed.txt
250,cradle2grave,Cradle 2 the Grave,imsdb,Cradle-2-the-Grave,https://imsdb.com/scripts/Cradle-2-the-Grave.html,Cradle 2 the Grave,2003-02-28,10623,"Gang leader Tony pulls off a major diamond heist with his crew, but cop-turned-criminal Ling knows who has the loot and responds by kidnapping Tony's daughter and holding her for ransom. Unfortunately, Tony's lost the diamonds as well. As he frantically searches for his daughter and the jewels, Tony pairs with a high-kicking government agent who once worked with Ling and seeks revenge on him.",Cradle 2 the Grave,2003,0306685,Cradle-2-the-Grave_dialogue.txt,Cradle-2-the-Grave_charinfo.txt,Cradle-2-the-Grave_parsed.txt
251,crank,Crank,imsdb,Crank,https://imsdb.com/scripts/Crank.html,Crank,2006-08-31,1948,"Chev Chelios, a hit man wanting to go straight, lets his latest target slip away. Then he awakes the next morning to a phone call that informs him he has been poisoned and has only an hour to live unless he keeps adrenaline coursing through his body while he searches for an antidote.",Crank,2006,0479884,Crank_dialogue.txt,Crank_charinfo.txt,Crank_parsed.txt
252,crash,Crash,imsdb,Crash,https://imsdb.com/scripts/Crash.html,Crash,2005-05-06,1640,"In post-Sept. 11 Los Angeles, tensions erupt when the lives of a Brentwood housewife, her district attorney husband, a Persian shopkeeper, two cops, a pair of carjackers and a Korean couple converge during a 36-hour period.",Crash,2004,0375679,Crash_dialogue.txt,Crash_charinfo.txt,Crash_parsed.txt
253,crazystupidlove,"Crazy, Stupid, Love",imsdb,Crazy-Stupid-Love,https://imsdb.com/scripts/Crazy%2C-Stupid%2C-Love.html,"Crazy, Stupid, Love.",2011-07-29,50646,"Cal Weaver is living the American dream. He has a good job, a beautiful house, great children and a beautiful wife, named Emily. Cal's seemingly perfect life unravels, however, when he learns that Emily has been unfaithful and wants a divorce. Over 40 and suddenly single, Cal is adrift in the fickle world of dating. Enter, Jacob Palmer, a self-styled player who takes Cal under his wing and teaches him how to be a hit with the ladies.","Crazy, Stupid, Love.",2011,1570728,Crazy-Stupid-Love_dialogue.txt,Crazy-Stupid-Love_charinfo.txt,Crazy-Stupid-Love_parsed.txt
254,crazylove,Crazylove,imsdb,Crazylove,https://imsdb.com/scripts/Crazylove.html,Crazylove,2005-10-22,43695,"Letty Mayer, young and beautiful, has a cherished job as a teacher, a successful attorney boyfriend, and a tight knit family that is excited about her sister's impending wedding. But inside Letty there1s an anxiety that1s building. Suddenly the pressure of Letty's world overwhelms her and she suffers a devastating nervous breakdown. Institutionalized, she meets Michael, a schizophrenic who has been in and out of hospitals his entire life. Although major obstacles exist, Letty and Michael throw caution to the wind to pursue an intense new love as Letty finds herself torn between a safe past and a daring future...",Crazylove,2005,0416658,Crazylove_dialogue.txt,Crazylove_charinfo.txt,Crazylove_parsed.txt
255,creation,Creation,imsdb,Creation,https://imsdb.com/scripts/Creation.html,Creation,2009-09-25,30431,"A psychological, heart-wrenching love story that provides a unique and inside look at Charles Darwin. Torn between faith and science, he struggles to finish his legendary book ""On the Origin of the Species,"" which goes on to become the foundation for evolutionary biology.",Creation of the Gods I: Kingdom of Storms,2023,6979756,Creation_dialogue.txt,Creation_charinfo.txt,Creation_parsed.txt
256,crimespree,Crime Spree,imsdb,Crime-Spree,https://imsdb.com/scripts/Crime-Spree.html,Crime Spree,2003-04-16,6277,"An out-of-town heist becomes a nightmare for a crew of French burglars when they mistakenly rob the head of the Chicago mafia. Unaccustomed to the ways of the American underworld, it is not long before they have the mafia, the FBI and a couple of street gangs on their backs as they attempt to make their way back to Paris.",Crime Spree,2003,0310924,Crime-Spree_dialogue.txt,Crime-Spree_charinfo.txt,Crime-Spree_parsed.txt
257,croods,"Croods, The",imsdb,Croods-The,https://imsdb.com/scripts/Croods%2C-The.html,The Croods,2013-03-15,49519,"The prehistoric Croods family live in a particularly dangerous moment in time. Patriarch Grug, his mate Ugga, teenage daughter Eep, son Thunk, and feisty Gran gather food by day and huddle together in a cave at night. When a more evolved caveman named Guy arrives on the scene, Grug is distrustful, but it soon becomes apparent that Guy is correct about the impending destruction of their world.",The Croods,2013,0481499,Croods-The_dialogue.txt,Croods-The_charinfo.txt,Croods-The_parsed.txt
258,crouchingtigerhiddendragon,"Crouching Tiger, Hidden Dragon",imsdb,Crouching-Tiger-Hidden-Dragon,https://imsdb.com/scripts/Crouching-Tiger%2C-Hidden-Dragon.html,"Crouching Tiger, Hidden Dragon",2000-07-06,146,"Two warriors in pursuit of a stolen sword and a notorious fugitive are led to an impetuous, physically-skilled, teenage nobleman's daughter, who is at a crossroads in her life.","New Crouching Tiger, Hidden Dragon",2001,3981658,Crouching-Tiger-Hidden-Dragon_dialogue.txt,Crouching-Tiger-Hidden-Dragon_charinfo.txt,Crouching-Tiger-Hidden-Dragon_parsed.txt
259,croupier,Croupier,imsdb,Croupier,https://imsdb.com/scripts/Croupier.html,Croupier,1998-06-25,12706,"Jack Manfred is an aspiring writer who to make ends meet, takes a job as a croupier. Jack remains an observer, knowing that everything in life is a gamble and that gamblers are born to lose. Inevitably, he gets sucked into the world of the casino which takes its toll on his relationships and the novel he is writing.",Croupier,1998,0159382,Croupier_dialogue.txt,Croupier_charinfo.txt,Croupier_parsed.txt
260,crow,"Crow, The",imsdb,Crow-The,https://imsdb.com/scripts/Crow%2C-The.html,The Crow,1994-05-11,9495,"Exactly one year after young rock guitarist Eric Draven and his fiancee are brutally killed by a ruthless gang of criminals, Draven--watched over by a hypnotic crow--returns from the grave to exact revenge.",The Crow,2024,1340094,Crow-The_dialogue.txt,Crow-The_charinfo.txt,Crow-The_parsed.txt
261,crowcityofangels,"Crow: City of Angels, The",imsdb,Crow-City-of-Angels-The,https://imsdb.com/scripts/Crow-City-of-Angels%2C-The.html,The Crow: City of Angels,1996-08-29,10546,"After Ashe and his little son are murdered violently for no reason by Judah's men, he returns from the dead to take revenge. One after one, Judah's people face the power of the dark angel. The second film based on James O'Barr's cult comic.",The Crow: City of Angels,1996,0115986,NA,NA,NA
262,cruelintentions,Cruel Intentions,imsdb,Cruel-Intentions,https://imsdb.com/scripts/Cruel-Intentions.html,Cruel Intentions,1999-03-05,796,"Slaking a thirst for dangerous games, Kathryn challenges her stepbrother, Sebastian, to deflower their headmaster's daughter before the summer ends. If he succeeds, the prize is the chance to bed Kathryn. But if he loses, Kathryn will claim his most prized possession.",Cruel Intentions,1999,0139134,Cruel-Intentions_dialogue.txt,Cruel-Intentions_charinfo.txt,Cruel-Intentions_parsed.txt
263,curiouscaseofbenjaminbutton,"Curious Case of Benjamin Button, The",imsdb,Curious-Case-of-Benjamin-Button-The,https://imsdb.com/scripts/Curious-Case-of-Benjamin-Button%2C-The.html,The Curious Case of Benjamin Button,2008-12-25,4922,"Born under unusual circumstances, Benjamin Button springs into being as an elderly man in a New Orleans nursing home and ages in reverse. Twelve years after his birth, he meets Daisy, a child who flits in and out of his life as she grows up to be a dancer. Though he has all sorts of unusual adventures over the course of his life, it is his relationship with Daisy, and the hope that they will come together at the right time, that drives Benjamin forward.",The Curious Case of Benjamin Button,2008,0421715,Curious-Case-of-Benjamin-Button-The_dialogue.txt,Curious-Case-of-Benjamin-Button-The_charinfo.txt,Curious-Case-of-Benjamin-Button-The_parsed.txt
264,custody,Custody,imsdb,Custody,https://imsdb.com/scripts/Custody.html,Custody,2016-04-17,390401,"When a hard-working single mother, Sara Diaz, has her children taken from her after she is suspected of injuring her son, Ally Fisher, a recent law school graduate, is assigned to represent her case before Judge Martha Schulman, a veteran of the Family Court System.",Custody,2017,6002232,Custody_dialogue.txt,Custody_charinfo.txt,Custody_parsed.txt
265,dallasbuyersclub,Dallas Buyers Club,imsdb,Dallas-Buyers-Club,https://imsdb.com/scripts/Dallas-Buyers-Club.html,Dallas Buyers Club,2013-11-01,152532,"Loosely based on the true-life tale of Ron Woodroof, a drug-taking, women-loving, homophobic man who in 1986 was diagnosed with HIV/AIDS and given thirty days to live.",Dallas Buyers Club,2013,0790636,Dallas-Buyers-Club_dialogue.txt,Dallas-Buyers-Club_charinfo.txt,Dallas-Buyers-Club_parsed.txt
266,damnedunited,"Damned United, The",imsdb,Damned-United-The,https://imsdb.com/scripts/Damned-United%2C-The.html,The Damned United,2009-03-27,21641,"Taking over Leeds United, Brian Clough's abrasive approach and his clear dislike of the players' dirty style of play make it certain there is going to be friction. Glimpses of his earlier career help explain both his hostility to previous manager Don Revie and how much he is missing right-hand man Peter Taylor.",The Damned United,2009,1226271,Damned-United-The_dialogue.txt,Damned-United-The_charinfo.txt,Damned-United-The_parsed.txt
267,danceswithwolves,Dances with Wolves,imsdb,Dances-with-Wolves,https://imsdb.com/scripts/Dances-with-Wolves.html,Dances with Wolves,1990-03-30,581,"Wounded Civil War soldier, John Dunbar tries to commit suicide--and becomes a hero instead. As a reward, he's assigned to his dream post, a remote junction on the Western frontier, and soon makes unlikely friends with the local Sioux tribe.",Dances with Wolves,1990,0099348,Dances-with-Wolves_dialogue.txt,Dances-with-Wolves_charinfo.txt,Dances-with-Wolves_parsed.txt
268,danishgirl,"Danish Girl, The",imsdb,Danish-Girl-The,https://imsdb.com/scripts/Danish-Girl%2C-The.html,The Danish Girl,2015-11-27,306819,"When Gerda Wegener asks her husband Einar to fill in as a portrait model, Einar discovers the person she's meant to be and begins living her life as Lili Elbe. Having realized her true self and with Gerda's love and support, Lili embarks on a groundbreaking journey as a transgender pioneer.",The Danish Girl,2015,0810819,Danish-Girl-The_dialogue.txt,Danish-Girl-The_charinfo.txt,Danish-Girl-The_parsed.txt
269,darkcity,Dark City,imsdb,Dark-City,https://imsdb.com/scripts/Dark-City.html,Dark City,1998-02-27,2666,"A man struggles with memories of his past, including a wife he cannot remember, in a nightmarish world with no sun and run by beings with telekinetic powers who seek the souls of humans.",Dark City,1998,0118929,Dark-City_dialogue.txt,Dark-City_charinfo.txt,Dark-City_parsed.txt
270,darkknightrises,"Dark Knight Rises, The",imsdb,Dark-Knight-Rises-The,https://imsdb.com/scripts/Dark-Knight-Rises%2C-The.html,The Dark Knight Rises,2012-07-17,49026,"Following the death of District Attorney Harvey Dent, Batman assumes responsibility for Dent's crimes to protect the late attorney's reputation and is subsequently hunted by the Gotham City Police Department. Eight years later, Batman encounters the mysterious Selina Kyle and the villainous Bane, a new terrorist leader who overwhelms Gotham's finest. The Dark Knight resurfaces to protect a city that has branded him an enemy.",The Dark Knight Rises,2012,1345836,Dark-Knight-Rises-The_dialogue.txt,Dark-Knight-Rises-The_charinfo.txt,Dark-Knight-Rises-The_parsed.txt
271,darkstar,Dark Star,imsdb,Dark-Star,https://imsdb.com/scripts/Dark-Star.html,Dark Star,1974-04-01,1410,"A group of scientists are sent on a mission to destroy unstable planets. Twenty years into their mission, they have to battle their alien mascot as well as a ""sensitive"" and intelligent bombing device that starts to question the meaning of its existence.",Dark Star,1974,0069945,Dark-Star_dialogue.txt,Dark-Star_charinfo.txt,Dark-Star_parsed.txt
272,darkman,Darkman,imsdb,Darkman,https://imsdb.com/scripts/Darkman.html,Darkman,1990-08-24,9556,"Dr. Peyton Westlake is on the verge of realizing a major breakthrough in synthetic skin when his laboratory is destroyed by gangsters. Having been burned beyond recognition and forever altered by an experimental medical procedure, Westlake becomes known as Darkman, assuming alternate identities in his quest for revenge and a new life with a former love.",Darkman,1990,0099365,Darkman_dialogue.txt,Darkman_charinfo.txt,Darkman_parsed.txt
273,datenight,Date Night,imsdb,Date-Night,https://imsdb.com/scripts/Date-Night.html,Date Night,2010-04-08,35056,"Phil and Claire Foster fear that their mild-mannered relationship may be falling into a stale rut. During their weekly date night, their dinner reservation leads to their being mistaken for a couple of thieves--and now a number of unsavoury characters want Phil and Claire killed.",Date Night,2010,1279935,Date-Night_dialogue.txt,Date-Night_charinfo.txt,Date-Night_parsed.txt
274,davebarryscompleteguidetoguys,Dave Barry's Complete Guide to Guys,imsdb,Dave-Barrys-Complete-Guide-to-Guys,https://imsdb.com/scripts/Dave-Barry%27s-Complete-Guide-to-Guys.html,Complete Guide to Guys,2005-01-01,30838,"Based on Dave Barry's book, the Complete guide to guys follows guyness from prehistoroc times, to current times and explains many of the mysteries we wonder. Like why do guys leave the toilet seat up, and why won't they ask for directions?",Complete Guide to Guys,2005,0407680,Dave-Barrys-Complete-Guide-to-Guys_dialogue.txt,Dave-Barrys-Complete-Guide-to-Guys_charinfo.txt,Dave-Barrys-Complete-Guide-to-Guys_parsed.txt
275,dawnofdead,Dawn of the Dead,imsdb,Dawn-of-the-Dead,https://imsdb.com/scripts/Dawn-of-the-Dead.html,Dawn of the Dead,2004-03-19,924,"A group of survivors take refuge in a shopping mall after the world is taken over by aggressive, flesh-eating zombies.",Dawn of the Dead,2004,0363547,Dawn-of-the-Dead_dialogue.txt,Dawn-of-the-Dead_charinfo.txt,Dawn-of-the-Dead_parsed.txt
276,dayofdead,Day of the Dead,imsdb,Day-of-the-Dead,https://imsdb.com/scripts/Day-of-the-Dead.html,Day of the Dead,1985-07-03,8408,A small group of scientists and soldiers take refuge in an underground missile silo where they struggle to control the flesh-eating dead that walks the Earth above.,Day of the Dead,1985,0088993,Day-of-the-Dead_dialogue.txt,Day-of-the-Dead_charinfo.txt,Day-of-the-Dead_parsed.txt
277,dayclowncried,"Day the Clown Cried, The",imsdb,Day-the-Clown-Cried-The,https://imsdb.com/scripts/Day-the-Clown-Cried%2C-The.html,The story of... The Day The Clown Cried,2016-01-04,471900,Jewish comedian David Schneider presents a look at some exclusive behind the scenes material from the notorious unseen Jerry Lewis film.,The Day the Clown Cried,1972,0068451,Day-the-Clown-Cried-The_dialogue.txt,Day-the-Clown-Cried-The_charinfo.txt,Day-the-Clown-Cried-The_parsed.txt
278,dayearthstoodstill,"Day the Earth Stood Still, The",imsdb,Day-the-Earth-Stood-Still-The,https://imsdb.com/scripts/Day-the-Earth-Stood-Still%2C-The.html,The Day the Earth Stood Still,2008-12-10,10200,"A representative of an alien race that went through drastic evolution to survive its own climate change, Klaatu comes to Earth to assess whether humanity can prevent the environmental damage they have inflicted on their own planet. When barred from speaking to the United Nations, he decides humankind shall be exterminated so the planet can survive.",The Day the Earth Stood Still,2008,0970416,Day-the-Earth-Stood-Still-The_dialogue.txt,Day-the-Earth-Stood-Still-The_charinfo.txt,Day-the-Earth-Stood-Still-The_parsed.txt
279,deadpoetssociety,Dead Poets Society,imsdb,Dead-Poets-Society,https://imsdb.com/scripts/Dead-Poets-Society.html,Dead Poets Society,1989-06-02,207,"At an elite, old-fashioned boarding school in New England, a passionate English teacher inspires his students to rebel against convention and seize the potential of every day, courting the disdain of the stern headmaster.",Dead Poets Society,1989,0097165,Dead-Poets-Society_dialogue.txt,Dead-Poets-Society_charinfo.txt,Dead-Poets-Society_parsed.txt
280,deadpool,Deadpool,imsdb,Deadpool,https://imsdb.com/scripts/Deadpool.html,Deadpool,2016-02-09,293660,"The origin story of former Special Forces operative turned mercenary Wade Wilson, who, after being subjected to a rogue experiment that leaves him with accelerated healing powers, adopts the alter ego Deadpool. Armed with his new abilities and a dark, twisted sense of humor, Deadpool hunts down the man who nearly destroyed his life.",Deadpool,2016,1431045,Deadpool_dialogue.txt,Deadpool_charinfo.txt,Deadpool_parsed.txt
281,dearwhitepeople,Dear White People,imsdb,Dear-White-People,https://imsdb.com/scripts/Dear-White-People.html,Dear White People,2014-10-17,114750,"Four college students attend an Ivy League college where a riot breaks out over an ""African-American"" themed party thrown by white students. With tongue planted firmly in cheek, the film explores racial identity in 'post racial' America while weaving a story about forging one's unique path in the world.",Dear White People,2017,5707802,Dear-White-People_dialogue.txt,Dear-White-People_charinfo.txt,Dear-White-People_parsed.txt
282,deathatfuneral,Death at a Funeral,imsdb,Death-at-a-Funeral,https://imsdb.com/scripts/Death-at-a-Funeral.html,Death at a Funeral,2007-08-17,2196,A myriad of outrageous calamities befalls an eccentric English clan with more than a few skeletons in its closets when the family's patriarch dies an unexpected death.,Death at a Funeral,2007,0795368,Death-at-a-Funeral_dialogue.txt,Death-at-a-Funeral_charinfo.txt,Death-at-a-Funeral_parsed.txt
283,deathtosmoochy,Death to Smoochy,imsdb,Death-to-Smoochy,https://imsdb.com/scripts/Death-to-Smoochy.html,Death to Smoochy,2002-03-29,9275,"Tells the story of Rainbow Randolph, the corrupt, costumed star of a popular children's TV show, who is fired over a bribery scandal and replaced by squeaky-clean Smoochy, a puffy fuchsia rhinoceros. As Smoochy catapults to fame - scoring hit ratings and the affections of a network executive - Randolph makes the unsuspecting rhino the target of his numerous outrageous attempts to exact revenge and reclaim his status as America's sweetheart.",Death to Smoochy,2002,0266452,Death-to-Smoochy_dialogue.txt,Death-to-Smoochy_charinfo.txt,Death-to-Smoochy_parsed.txt
284,debt,"Debt, The",imsdb,Debt-The,https://imsdb.com/scripts/Debt%2C-The.html,The Debt,2003-08-31,146636,An ex-robber reluctantly agrees to do one last job in order to protect his family.,The Debt,2010,1226753,Debt-The_dialogue.txt,Debt-The_charinfo.txt,Debt-The_parsed.txt
285,deception,Deception,imsdb,Deception,https://imsdb.com/scripts/Deception.html,Deception,2008-04-24,13018,"As a corporate auditor who works in a number of different offices, Jonathan McQuarry wanders without an anchor among New York's power brokers. A chance meeting with charismatic lawyer Wyatt Bose leads to Jonathan's introduction to The List, an underground sex club. Jonathan begins an affair with a woman known only as S, who introduces Jonathan to a world of treachery and murder.",The Best Offer,2013,1924396,Deception_dialogue.txt,Deception_charinfo.txt,Deception_parsed.txt
286,deepcover,Deep Cover,imsdb,Deep-Cover,https://imsdb.com/scripts/Deep-Cover.html,Deep Cover,1992-04-15,20676,"Black police officer Russell Stevens applies for a special anti-drug squad which targets the highest boss of cocaine delivery to LA--the Colombian foreign minister's nephew. Russell works his way up from the bottom undercover, until he reaches the boss.",NA,NA,NA,Deep-Cover_dialogue.txt,Deep-Cover_charinfo.txt,Deep-Cover_parsed.txt
287,deeprising,Deep Rising,imsdb,Deep-Rising,https://imsdb.com/scripts/Deep-Rising.html,Deep Rising,1998-01-30,9457,"A group of heavily armed hijackers board a luxury ocean liner in the South Pacific Ocean to loot it, only to do battle with a series of large-sized, tentacled, man-eating sea creatures who have taken over the ship first.",Deep Rising,1998,0118956,Deep-Rising_dialogue.txt,Deep-Rising_charinfo.txt,Deep-Rising_parsed.txt
288,deerhunter,"Deer Hunter, The",imsdb,Deer-Hunter-The,https://imsdb.com/scripts/Deer-Hunter%2C-The.html,The Deer Hunter,1978-12-08,11778,"A group of working-class friends decide to enlist in the Army during the Vietnam War and finds it to be hellish chaos -- not the noble venture they imagined. Before they left, Steven married his pregnant girlfriend -- and Michael and Nick were in love with the same woman. But all three are different men upon their return.",The Deer Hunter,1978,0077416,Deer-Hunter-The_dialogue.txt,Deer-Hunter-The_charinfo.txt,Deer-Hunter-The_parsed.txt
289,defiance,Defiance,imsdb,Defiance,https://imsdb.com/scripts/Defiance.html,Defiance,2008-12-31,13813,"Based on a true story, during World War II, four Jewish brothers escape their Nazi-occupied homeland of West Belarus in Poland and join the Soviet partisans to combat the Nazis. The brothers begin the rescue of roughly 1,200 Jews still trapped in the ghettos of Poland.",Defiance,2008,1034303,Defiance_dialogue.txt,Defiance_charinfo.txt,Defiance_parsed.txt
290,departed,"Departed, The",imsdb,Departed-The,https://imsdb.com/scripts/Departed%2C-The.html,The Departed,2006-10-04,1422,"To take down South Boston's Irish Mafia, the police send in one of their own to infiltrate the underworld, not realizing the syndicate has done likewise. While an undercover cop curries favor with the mob kingpin, a career criminal rises through the police ranks. But both sides soon discover there's a mole among them.",The Departed,2006,0407887,Departed-The_dialogue.txt,Departed-The_charinfo.txt,Departed-The_parsed.txt
291,descendants,"Descendants, The",imsdb,Descendants-The,https://imsdb.com/scripts/Descendants%2C-The.html,The Descendants,2011-09-09,65057,"With his wife Elizabeth on life support after a boating accident, Hawaiian land baron Matt King takes his daughters on a trip from Oahu to Kauai to confront a young real estate broker, who was having an affair with Elizabeth before her misfortune.",The Descendants,2011,1033575,Descendants-The_dialogue.txt,Descendants-The_charinfo.txt,Descendants-The_parsed.txt
292,despicableme2,Despicable Me 2,imsdb,Despicable-Me-2,https://imsdb.com/scripts/Despicable-Me-2.html,Despicable Me 2,2013-06-26,93456,Gru is recruited by the Anti-Villain League to help deal with a powerful new super criminal.,Despicable Me 2,2013,1690953,Despicable-Me-2_dialogue.txt,Despicable-Me-2_charinfo.txt,Despicable-Me-2_parsed.txt
293,detroitrockcity,Detroit Rock City,imsdb,Detroit-Rock-City,https://imsdb.com/scripts/Detroit-Rock-City.html,Detroit Rock City,1999-08-13,9781,"In 1978, a Kiss concert was an epoch-making event. For the three teen fans in Detroit Rock City getting tickets to the sold-out show becomes the focal point of their existence. They'll do anything for tickets -- compete in a strip club's amateur-night contest, take on religious protesters, even rob a convenience store!",Detroit Rock City,1999,0165710,Detroit-Rock-City_dialogue.txt,Detroit-Rock-City_charinfo.txt,Detroit-Rock-City_parsed.txt
294,devilinbluedress,Devil in a Blue Dress,imsdb,Devil-in-a-Blue-Dress,https://imsdb.com/scripts/Devil-in-a-Blue-Dress.html,Devil in a Blue Dress,1995-09-29,8512,"In late 1940s Los Angeles, Easy Rawlins is an unemployed black World War II veteran with few job prospects. At a bar, Easy meets DeWitt Albright, a mysterious white man looking for someone to investigate the disappearance of a missing white woman named Daphne Monet, who he suspects is hiding out in one of the city's black jazz clubs. Strapped for money and facing house payments, Easy takes the job, but soon finds himself in over his head.",Devil in a Blue Dress,1995,0112857,Devil-in-a-Blue-Dress_dialogue.txt,Devil-in-a-Blue-Dress_charinfo.txt,Devil-in-a-Blue-Dress_parsed.txt
295,devilwearsprada,"Devil Wears Prada, The",imsdb,Devil-Wears-Prada-The,https://imsdb.com/scripts/Devil-Wears-Prada%2C-The.html,The Devil Wears Prada,2006-06-29,350,"Andy moves to New York to work in the fashion industry. Her boss is extremely demanding, cruel and won't let her succeed if she doesn't fit into the high class elegant look of their magazine.",The Devil Wears Prada,2006,0458352,Devil-Wears-Prada-The_dialogue.txt,Devil-Wears-Prada-The_charinfo.txt,Devil-Wears-Prada-The_parsed.txt
296,devilsadvocate,Devil's Advocate,imsdb,Devils-Advocate,https://imsdb.com/scripts/Devil%27s-Advocate.html,The Devil's Advocate,1997-10-17,1813,"Aspiring Florida defense lawyer Kevin Lomax accepts a job at a New York law firm. With the stakes getting higher every case, Kevin quickly learns that his boss has something far more evil planned.",The Devil's Advocate,1997,0118971,Devils-Advocate_dialogue.txt,Devils-Advocate_charinfo.txt,Devils-Advocate_parsed.txt
