id,movie_key,name,source,file_name,script_url,tmdb_title,release_date,tmdb_id,overview,imdb_title,imdb_release_date,imdb_id,dialogue,charinfo,tagged
494,hurtlocker,"Hurt Locker, The",imsdb,Hurt-Locker-The,https://imsdb.com/scripts/Hurt-Locker%2C-The.html,The Hurt Locker,2008-10-10,12162,"During the Iraq War, a Sergeant recently assigned to an army bomb squad is put at odds with his squad mates due to his maverick way of handling his work.",The Hurt Locker,2008,0887912,Hurt-Locker-The_dialogue.txt,Hurt-Locker-The_charinfo.txt,Hurt-Locker-The_parsed.txt
495,iamnumberfour,I Am Number Four,imsdb,I-Am-Number-Four,https://imsdb.com/scripts/I-Am-Number-Four.html,I Am Number Four,2011-02-18,46529,"A teenage fugitive with an incredible secret races to stay one step ahead of the mysterious forces seeking destroy him in this sci-fi action thriller. With three dead and one on the run, the race to find the elusive Number Four begins. Outwardly normal teen John Smith never gets too comfortable in the same identity, and along with his guardian, Henri, he is constantly moving from town to town. With each passing day, John gains a stronger grasp on his extraordinary new powers, and his bond to the beings that share his fantastic fate grows stronger.",I Am Number Four,2011,1464540,I-Am-Number-Four_dialogue.txt,I-Am-Number-Four_charinfo.txt,I-Am-Number-Four_parsed.txt
496,iamsam,I am Sam,imsdb,I-am-Sam,https://imsdb.com/scripts/I-am-Sam.html,I Am Sam,2001-12-28,10950,"Sam, a neurodivergent man, has a daughter with a homeless woman who abandons them when they leave the hospital, leaving Sam to raise Lucy on his own. But as Lucy grows up, Sam's limitations as a parent start to become a problem and the authorities take her away. Sam convinces high-priced lawyer Rita to take his case pro bono and in turn teaches her the value of love and family.",I Am Sam,2001,0277027,I-am-Sam_dialogue.txt,I-am-Sam_charinfo.txt,I-am-Sam_parsed.txt
497,iloveyouphillipmorris,I Love You Phillip Morris,imsdb,I-Love-You-Phillip-Morris,https://imsdb.com/scripts/I-Love-You-Phillip-Morris.html,I Love You Phillip Morris,2010-02-04,8952,"Steven Russell leads a seemingly average life - an organ player in the local church, happily married to Debbie, and a member of the local police force. That is until he has a severe car accident that leads him to the ultimate epiphany: he's gay and he's going to live life to the fullest - even if he has to break the law to do it. Taking on an extravagant lifestyle, Steven turns to cons and fraud to make ends meet and is eventually sent to the State Penitentiary where he meets the love of his life, a sensitive, soft-spoken man named Phillip Morris. His devotion to freeing Phillip from jail and building the perfect life together prompts him to attempt (and often succeed at) one impossible con after another.",I Love You Phillip Morris,2009,1045772,I-Love-You-Phillip-Morris_dialogue.txt,I-Love-You-Phillip-Morris_charinfo.txt,I-Love-You-Phillip-Morris_parsed.txt
498,ispitonyourgrave,I Spit on Your Grave,imsdb,I-Spit-on-Your-Grave,https://imsdb.com/scripts/I-Spit-on-Your-Grave.html,I Spit on Your Grave,2010-06-17,43947,"Jennifer is a writer working on a new novel and, needing to get out of the city to finish it, hires a riverside apartment in upstate New York to finish her book--attracting the attention of a number of rowdy male locals.",I Spit on Your Grave,2010,1242432,I-Spit-on-Your-Grave_dialogue.txt,I-Spit-on-Your-Grave_charinfo.txt,I-Spit-on-Your-Grave_parsed.txt
499,istillknowwhatyoudidlastsummer,I Still Know What You Did Last Summer,imsdb,I-Still-Know-What-You-Did-Last-Summer,https://imsdb.com/scripts/I-Still-Know-What-You-Did-Last-Summer.html,I Still Know What You Did Last Summer,1998-11-13,3600,"Ever since killing the Fisherman one year ago, Julie James is still haunted by images of him after her. When her best friend Karla wins free tickets to the Bahamas, Julie finds this a perfect opportunity to finally relax. But someone is waiting for her. Someone who she thought was dead. Someone who is out again for revenge.",I Still Know What You Did Last Summer,1998,0130018,I-Still-Know-What-You-Did-Last-Summer_dialogue.txt,I-Still-Know-What-You-Did-Last-Summer_charinfo.txt,I-Still-Know-What-You-Did-Last-Summer_parsed.txt
500,illdoanything,I'll Do Anything,imsdb,Ill-Do-Anything,https://imsdb.com/scripts/I%27ll-Do-Anything.html,I'll Do Anything,1994-02-04,106143,"Matt Hobbs is a talented but unsuccessful actor. When estranged (and strange) ex-wife Beth dumps their daughter Jeannie on Matt, father and daughter have a lot of adjusting to do. His budding relationship with attractive production assistant Cathy Breslow is made complicated, while the precocious child is overly accustomed to getting her own way. Matt eventually faces the choice of family vs career in a particularly difficult way.",I'll Do Anything,1994,0110097,Ill-Do-Anything_dialogue.txt,Ill-Do-Anything_charinfo.txt,Ill-Do-Anything_parsed.txt
501,irobot,"I, Robot",imsdb,I-Robot,https://imsdb.com/scripts/I%2C-Robot.html,"I, Robot",2004-07-15,2048,"In 2035, where robots are commonplace and abide by the three laws of robotics, a technophobic cop investigates an apparent suicide. Suspecting that a robot may be responsible for the death, his investigation leads him to believe that humanity may be in danger.","I, Robot",2004,0343818,I-Robot_dialogue.txt,I-Robot_charinfo.txt,I-Robot_parsed.txt
502,icestorm,"Ice Storm, The",imsdb,Ice-Storm-The,https://imsdb.com/scripts/Ice-Storm%2C-The.html,The Ice Storm,1997-02-05,68924,"In the weekend after thanksgiving 1973 the Hood family is skidding out of control. Then an ice storm hits, the worst in a century.",The Ice Storm,1997,0119349,Ice-Storm-The_dialogue.txt,Ice-Storm-The_charinfo.txt,Ice-Storm-The_parsed.txt
503,idesofmarch,"Ides of March, The",imsdb,Ides-of-March-The,https://imsdb.com/scripts/Ides-of-March%2C-The.html,The Ides of March,2011-09-24,10316,Dirty tricks stand to soil an ambitious young press spokesman's idealism in a cutthroat presidential campaign where 'victory' is relative.,The Ides of March,2011,1124035,Ides-of-March-The_dialogue.txt,Ides-of-March-The_charinfo.txt,Ides-of-March-The_parsed.txt
504,imaginariumofdoctorparnassus,"Imaginarium of Doctor Parnassus, The",imsdb,Imaginarium-of-Doctor-Parnassus-The,https://imsdb.com/scripts/Imaginarium-of-Doctor-Parnassus%2C-The.html,The Imaginarium of Doctor Parnassus,2009-10-01,8054,A travelling theatre company has more to it than meets the eye. It is an imaginary world commanded by the mind of Doctor Parnassus and the audience is in for more than just a show.,The Imaginarium of Doctor Parnassus,2009,1054606,Imaginarium-of-Doctor-Parnassus-The_dialogue.txt,Imaginarium-of-Doctor-Parnassus-The_charinfo.txt,Imaginarium-of-Doctor-Parnassus-The_parsed.txt
505,inbedroom,In the Bedroom,imsdb,In-the-Bedroom,https://imsdb.com/scripts/In-the-Bedroom.html,In the Bedroom,2001-11-23,1999,"Summertime on the coast of Maine, ""In the Bedroom"" centers on the inner dynamics of a family in transition. Matt Fowler is a doctor practicing in his native Maine and is married to New York born Ruth Fowler, a music teacher. His son is involved in a love affair with a local single mother. As the beauty of Maine's brief and fleeting summer comes to an end, these characters find themselves in the midst of unimaginable tragedy.",In the Bedroom,2001,0247425,In-the-Bedroom_dialogue.txt,In-the-Bedroom_charinfo.txt,In-the-Bedroom_parsed.txt
506,inloop,In the Loop,imsdb,In-the-Loop,https://imsdb.com/scripts/In-the-Loop.html,In the Loop,2009-01-22,19833,"The US President and the UK Prime Minister are planning on launching a war in the Middle East, but--behind the scenes--government officials and advisers are either promoting the war or are trying to prevent it.",In the Loop,2009,1226774,In-the-Loop_dialogue.txt,In-the-Loop_charinfo.txt,In-the-Loop_parsed.txt
507,inception,Inception,imsdb,Inception,https://imsdb.com/scripts/Inception.html,Inception,2010-07-15,27205,"Cobb, a skilled thief who commits corporate espionage by infiltrating the subconscious of his targets is offered a chance to regain his old life as payment for a task considered to be impossible: ""inception"", the implantation of another person's idea into a target's subconscious.",Inception,2010,1375666,Inception_dialogue.txt,Inception_charinfo.txt,Inception_parsed.txt
508,indianajoneslastcrusade,Indiana Jones and the Last Crusade,imsdb,Indiana-Jones-and-the-Last-Crusade,https://imsdb.com/scripts/Indiana-Jones-and-the-Last-Crusade.html,Indiana Jones and the Last Crusade,1989-05-24,89,"In 1938, an art collector appeals to eminent archaeologist Dr. Indiana Jones to embark on a search for the Holy Grail. Indy learns that a medieval historian has vanished while searching for it, and the missing man is his own father, Dr. Henry Jones Sr.. He sets out to rescue his father by following clues in the old man's notebook, which his father had mailed to him before he went missing. Indy arrives in Venice, where he enlists the help of a beautiful academic, Dr. Elsa Schneider, along with Marcus Brody and Sallah. Together they must stop the Nazis from recovering the power of eternal life and taking over the world!",Indiana Jones and the Last Crusade,1989,0097576,Indiana-Jones-and-the-Last-Crusade_dialogue.txt,Indiana-Jones-and-the-Last-Crusade_charinfo.txt,Indiana-Jones-and-the-Last-Crusade_parsed.txt
509,indianajonesraidersoflostark,Indiana Jones and the Raiders of the Lost Ark,imsdb,Indiana-Jones-and-the-Raiders-of-the-Lost-Ark,https://imsdb.com/scripts/Indiana-Jones-and-the-Raiders-of-the-Lost-Ark.html,Raiders of the Lost Ark,1981-06-12,85,"When Dr. Indiana Jones - the tweed-suited professor who just happens to be a celebrated archaeologist - is hired by the government to locate the legendary Ark of the Covenant, he finds himself up against the entire Nazi regime.",Raiders of the Lost Ark,1981,0082971,Indiana-Jones-and-the-Raiders-of-the-Lost-Ark_dialogue.txt,Indiana-Jones-and-the-Raiders-of-the-Lost-Ark_charinfo.txt,Indiana-Jones-and-the-Raiders-of-the-Lost-Ark_parsed.txt
510,indianajonestempleofdoom,Indiana Jones and the Temple of Doom,imsdb,Indiana-Jones-and-the-Temple-of-Doom,https://imsdb.com/scripts/Indiana-Jones-and-the-Temple-of-Doom.html,Indiana Jones and the Temple of Doom,1984-05-23,87,"After arriving in India, Indiana Jones is asked by a desperate village to find a mystical stone. He agrees - and stumbles upon a secret cult plotting a terrible plan in the catacombs of an ancient palace.",Indiana Jones and the Temple of Doom,1984,0087469,Indiana-Jones-and-the-Temple-of-Doom_dialogue.txt,Indiana-Jones-and-the-Temple-of-Doom_charinfo.txt,Indiana-Jones-and-the-Temple-of-Doom_parsed.txt
511,indianajonesiv,Indiana Jones IV,imsdb,Indiana-Jones-IV,https://imsdb.com/scripts/Indiana-Jones-IV.html,Indiana Jones and the Kingdom of the Crystal Skull,2008-05-21,217,"Set during the Cold War, the Soviets--led by sword-wielding Irina Spalko--are in search of a crystal skull which has supernatural powers related to a mystical Lost City of Gold. Indy is coerced to head to Peru at the behest of a young man whose friend--and Indy's colleague--Professor Oxley has been captured for his knowledge of the skull's whereabouts.",Indiana Jones and the Dial of Destiny,2023,1462764,Indiana-Jones-IV_dialogue.txt,Indiana-Jones-IV_charinfo.txt,Indiana-Jones-IV_parsed.txt
512,informant,"Informant, The",imsdb,Informant-The,https://imsdb.com/scripts/Informant%2C-The.html,The Informant,2013-09-11,204046,A story centered on a man who works as an informant for the French border patrol.,The Informant!,2009,1130080,Informant-The_dialogue.txt,Informant-The_charinfo.txt,Informant-The_parsed.txt
513,inglouriousbasterds,Inglourious Basterds,imsdb,Inglourious-Basterds,https://imsdb.com/scripts/Inglourious-Basterds.html,Inglourious Basterds,2009-08-02,16869,"In Nazi-occupied France during World War II, a group of Jewish-American soldiers known as ""The Basterds"" are chosen specifically to spread fear throughout the Third Reich by scalping and brutally killing Nazis. The Basterds, lead by Lt. Aldo Raine soon cross paths with a French-Jewish teenage girl who runs a movie theater in Paris which is targeted by the soldiers.",Inglourious Basterds,2009,0361748,Inglourious-Basterds_dialogue.txt,Inglourious-Basterds_charinfo.txt,Inglourious-Basterds_parsed.txt
514,insider,"Insider, The",imsdb,Insider-The,https://imsdb.com/scripts/Insider%2C-The.html,The Insider,1999-10-28,9008,A research chemist comes under personal and professional attack when he decides to appear in a 60 Minutes expose on Big Tobacco.,The Insider,1999,0140352,Insider-The_dialogue.txt,Insider-The_charinfo.txt,Insider-The_parsed.txt
515,insidious,Insidious,imsdb,Insidious,https://imsdb.com/scripts/Insidious.html,Insidious,2011-03-31,49018,"A family discovers that dark spirits have invaded their home after their son inexplicably falls into an endless sleep. When they reach out to a professional for help, they learn things are a lot more personal than they thought.",Insidious,2010,1591095,Insidious_dialogue.txt,Insidious_charinfo.txt,Insidious_parsed.txt
516,insomnia,Insomnia,imsdb,Insomnia,https://imsdb.com/scripts/Insomnia.html,Insomnia,2002-05-24,320,Two Los Angeles homicide detectives are dispatched to a northern town where the sun doesn't set to investigate the methodical murder of a local teen.,Insomnia,2002,0278504,Insomnia_dialogue.txt,Insomnia_charinfo.txt,Insomnia_parsed.txt
517,interstellar,Interstellar,imsdb,Interstellar,https://imsdb.com/scripts/Interstellar.html,Interstellar,2014-11-05,157336,The adventures of a group of explorers who make use of a newly discovered wormhole to surpass the limitations on human space travel and conquer the vast distances involved in an interstellar voyage.,Interstellar,2014,0816692,Interstellar_dialogue.txt,Interstellar_charinfo.txt,Interstellar_parsed.txt
518,interviewwithvampire,Interview with the Vampire,imsdb,Interview-with-the-Vampire,https://imsdb.com/scripts/Interview-with-the-Vampire.html,Interview with the Vampire,1994-11-11,628,"A vampire relates his epic life story of love, betrayal, loneliness, and dark hunger to an over-curious reporter.",Interview with the Vampire,2022,14921986,Interview-with-the-Vampire_dialogue.txt,Interview-with-the-Vampire_charinfo.txt,Interview-with-the-Vampire_parsed.txt
519,intowild,Into the Wild,imsdb,Into-the-Wild,https://imsdb.com/scripts/Into-the-Wild.html,Into the Wild,2007-09-21,5915,"After graduating from Emory University in 1992, top student and athlete Christopher McCandless abandons his possessions, gives his entire $24,000 savings account to charity, and hitchhikes to Alaska to live in the wilderness.",Into the Wild,2007,0758758,Into-the-Wild_dialogue.txt,Into-the-Wild_charinfo.txt,Into-the-Wild_parsed.txt
520,intowoods,Into the Woods,imsdb,Into-the-Woods,https://imsdb.com/scripts/Into-the-Woods.html,Into the Woods,2014-12-24,224141,"In a woods filled with magic and fairy tale characters, a baker and his wife set out to end the curse put on them by their neighbor, a spiteful witch.",Into the Woods,2014,2180411,Into-the-Woods_dialogue.txt,Into-the-Woods_charinfo.txt,Into-the-Woods_parsed.txt
521,intolerablecruelty,Intolerable Cruelty,imsdb,Intolerable-Cruelty,https://imsdb.com/scripts/Intolerable-Cruelty.html,Intolerable Cruelty,2003-09-02,11775,A revenge-seeking gold digger marries a womanizing Beverly Hills lawyer with the intention of making a killing in the divorce.,Intolerable Cruelty,2003,0138524,Intolerable-Cruelty_dialogue.txt,Intolerable-Cruelty_charinfo.txt,Intolerable-Cruelty_parsed.txt
522,inventingabbotts,Inventing the Abbotts,imsdb,Inventing-the-Abbotts,https://imsdb.com/scripts/Inventing-the-Abbotts.html,Inventing the Abbotts,1997-04-04,12723,"In the 1950s, brothers Jacey and Doug Holt, who come from the poorer side of their sleepy Midwestern town, vie for the affections of the wealthy, lovely Abbott sisters. Lady-killer Jacey alternates between Eleanor and Alice, wanting simply to break the hearts of rich young women. But sensitive Doug has a real romance with Pamela, which Jacey and the Abbott patriarch, Lloyd, both frown upon.",Inventing the Abbotts,1997,0119381,Inventing-the-Abbotts_dialogue.txt,Inventing-the-Abbotts_charinfo.txt,Inventing-the-Abbotts_parsed.txt
523,inventionoflying,"Invention of Lying, The",imsdb,Invention-of-Lying-The,https://imsdb.com/scripts/Invention-of-Lying%2C-The.html,The Invention of Lying,2009-10-02,23082,"Set in a world where the concept of lying doesn't exist, a loser changes his lot when he invents lying and uses it to get ahead.",The Invention of Lying,2009,1058017,Invention-of-Lying-The_dialogue.txt,Invention-of-Lying-The_charinfo.txt,Invention-of-Lying-The_parsed.txt
524,invictus,Invictus,imsdb,Invictus,https://imsdb.com/scripts/Invictus.html,Invictus,2009-12-10,22954,"Newly elected President Nelson Mandela knows his nation remains racially and economically divided in the wake of apartheid. Believing he can bring his people together through the universal language of sport, Mandela rallies South Africa's rugby team as they make their historic run to the 1995 Rugby World Cup Championship match.",Invictus,2009,1057500,Invictus_dialogue.txt,Invictus_charinfo.txt,Invictus_parsed.txt
525,ironlady,"Iron Lady, The",imsdb,Iron-Lady-The,https://imsdb.com/scripts/Iron-Lady%2C-The.html,The Iron Lady,2011-12-26,71688,"A look at the life of Margaret Thatcher, the former Prime Minister of the United Kingdom, with a focus on the price she paid for power.",The Iron Lady,2011,1007029,Iron-Lady-The_dialogue.txt,Iron-Lady-The_charinfo.txt,Iron-Lady-The_parsed.txt
526,island,"Island, The",imsdb,Island-The,https://imsdb.com/scripts/Island%2C-The.html,The Island,1980-06-13,7988,"David Nau leads a band of modern day pirates who raid yachts and sail boats of people on vacation in the Caribbean. When reporter Blair Maynard and his son arrive to investigate the mystery of the disappearing boats, Nau and his band of raiders decide to induct them into their tribe.",The Island,2005,0399201,Island-The_dialogue.txt,Island-The_charinfo.txt,Island-The_parsed.txt
527,it,It,imsdb,It,https://imsdb.com/scripts/It.html,It,2017-09-06,346364,"In a small town in Maine, seven children known as The Losers Club come face to face with life problems, bullies and a monster that takes the shape of a clown called Pennywise.",It,2017,1396484,It_dialogue.txt,It_charinfo.txt,It_parsed.txt
528,ithappenedonenight,It Happened One Night,imsdb,It-Happened-One-Night,https://imsdb.com/scripts/It-Happened-One-Night.html,It Happened One Night,1934-02-22,3078,"A renegade reporter and a young heiress meet on a bus heading for New York, and end up stuck with each other when the bus leaves them behind at one of the stops.",It Happened One Night,1934,0025316,NA,NA,NA
529,itswonderfullife,It's a Wonderful Life,imsdb,Its-a-Wonderful-Life,https://imsdb.com/scripts/It%27s-a-Wonderful-Life.html,It's a Wonderful Life,1946-12-20,1585,"A holiday favourite for generations...  George Bailey has spent his entire life giving to the people of Bedford Falls.  All that prevents rich skinflint Mr. Potter from taking over the entire town is George's modest building and loan company.  But on Christmas Eve the business's $8,000 is lost and George's troubles begin.",It's a Wonderful Life,1946,0038650,Its-a-Wonderful-Life_dialogue.txt,Its-a-Wonderful-Life_charinfo.txt,Its-a-Wonderful-Life_parsed.txt
530,itscomplicated,It's Complicated,imsdb,Its-Complicated,https://imsdb.com/scripts/It%27s-Complicated.html,It's Complicated,2009-12-23,22897,"Ten years after their divorce, Jane and Jake Adler unite for their son's college graduation and unexpectedly end up sleeping together. But Jake is married, and Jane is embarking on a new romance with her architect. Now, she has to sort out her life--just when she thought she had it all figured out.",It's Complicated,2009,1230414,Its-Complicated_dialogue.txt,Its-Complicated_charinfo.txt,Its-Complicated_parsed.txt
531,italianjob,"Italian Job, The",imsdb,Italian-Job-The,https://imsdb.com/scripts/Italian-Job%2C-The.html,The Italian Job,2003-05-30,9654,"Charlie Croker pulled off the crime of a lifetime. The one thing that he didn't plan on was being double-crossed. Along with a drop-dead gorgeous safecracker, Croker and his team take off to re-steal the loot and end up in a pulse-pounding, pedal-to-the-metal chase that careens up, down, above and below the streets of Los Angeles.",The Italian Job,2003,0317740,Italian-Job-The_dialogue.txt,Italian-Job-The_charinfo.txt,Italian-Job-The_parsed.txt
532,jacket,"Jacket, The",imsdb,Jacket-The,https://imsdb.com/scripts/Jacket%2C-The.html,The Jacket,2005-03-04,9667,"A military veteran goes on a journey into the future, where he can foresee his death and is left with questions that could save his life and those he loves.",The Jacket,2005,0366627,Jacket-The_dialogue.txt,Jacket-The_charinfo.txt,Jacket-The_parsed.txt
533,jackiebrown,Jackie Brown,imsdb,Jackie-Brown,https://imsdb.com/scripts/Jackie-Brown.html,Jackie Brown,1997-12-25,184,"Jackie Brown is a flight attendant who gets caught in the middle of smuggling cash into the country for her gunrunner boss. When the cops try to use Jackie to get to her boss, she hatches a plan -- with help from a bail bondsman -- to keep the money for herself.",Jackie Brown,1997,0119396,Jackie-Brown_dialogue.txt,Jackie-Brown_charinfo.txt,Jackie-Brown_parsed.txt
534,jacobsladder,Jacob's Ladder,imsdb,Jacobs-Ladder,https://imsdb.com/scripts/Jacob%27s-Ladder.html,Jacob's Ladder,1990-11-02,2291,"After returning home from the Vietnam War, veteran Jacob Singer struggles to maintain his sanity. Plagued by hallucinations and flashbacks, Singer rapidly falls apart as the world and people around him morph and twist into disturbing images. His girlfriend, Jezzie, and ex-wife, Sarah, try to help, but to little avail. Even Singer's chiropractor friend, Louis, fails to reach him as he descends into madness.",Jacob's Ladder,1990,0099871,Jacobs-Ladder_dialogue.txt,Jacobs-Ladder_charinfo.txt,Jacobs-Ladder_parsed.txt
535,janeeyre,Jane Eyre,imsdb,Jane-Eyre,https://imsdb.com/scripts/Jane-Eyre.html,Jane Eyre,2011-03-11,38684,"After a bleak childhood, Jane Eyre goes out into the world to become a governess. As she lives happily in her new position at Thornfield Hall, she meet the dark, cold, and abrupt master of the house, Mr. Rochester. Jane and her employer grow close in friendship and she soon finds herself falling in love with him. Happiness seems to have found Jane at last, but could Mr. Rochester's terrible secret be about to destroy it forever?",Jane Eyre,2011,1229822,Jane-Eyre_dialogue.txt,Jane-Eyre_charinfo.txt,Jane-Eyre_parsed.txt
536,jasonx,Jason X,imsdb,Jason-X,https://imsdb.com/scripts/Jason-X.html,Jason X,2001-11-09,11470,"In the year 2455, Old Earth is now a contaminated planet abandoned for centuries -- a brown world of violent storms, toxic landmasses and poisonous seas. Yet humans have returned to the deadly place that they once fled, not to live, but to research the ancient, rusting artifacts of the long-gone civilizations. But it's not the harmful environment that could prove fatal to the intrepid, young explorers who have just landed on Old Earth. For them, it's Friday the 13th, and Jason lives!",Jason X,2001,0211443,Jason-X_dialogue.txt,Jason-X_charinfo.txt,Jason-X_parsed.txt
537,jaws,Jaws,imsdb,Jaws,https://imsdb.com/scripts/Jaws.html,Jaws,1975-06-20,578,"When the seaside community of Amity finds itself under attack by a dangerous great white shark, the town's chief of police, a young marine biologist, and a grizzled hunter embark on a desperate quest to destroy the beast before it strikes again.",Jaws,1975,0073195,Jaws_dialogue.txt,Jaws_charinfo.txt,Jaws_parsed.txt
538,jaws2,Jaws 2,imsdb,Jaws-2,https://imsdb.com/scripts/Jaws-2.html,Jaws 2,1978-06-16,579,Police chief Brody must protect the citizens of Amity after a second monstrous shark begins terrorizing the waters.,Jaws 2,1978,0077766,Jaws-2_dialogue.txt,Jaws-2_charinfo.txt,Jaws-2_parsed.txt
539,jaysilentbobstrikeback,Jay and Silent Bob Strike Back,imsdb,Jay-and-Silent-Bob-Strike-Back,https://imsdb.com/scripts/Jay-and-Silent-Bob-Strike-Back.html,Jay and Silent Bob Strike Back,2001-08-22,2294,"When Jay and Silent Bob learn that their comic-book alter egos, Bluntman and Chronic, have been sold to Hollywood as part of a big-screen movie that leaves them out of any royalties, the pair travels to Tinseltown to sabotage the production.",Jay and Silent Bob Strike Back,2001,0261392,Jay-and-Silent-Bob-Strike-Back_dialogue.txt,Jay-and-Silent-Bob-Strike-Back_charinfo.txt,Jay-and-Silent-Bob-Strike-Back_parsed.txt
540,jennifereight,Jennifer Eight,imsdb,Jennifer-Eight,https://imsdb.com/scripts/Jennifer-Eight.html,Jennifer Eight,1992-11-06,10424,"John Berlin, a big-city cop from LA moves to a small-town police force and immediately finds himself investigating a murder. Using theories rejected by his colleagues, Berlin meets a young blind woman named Helena, whom he is attracted to. Meanwhile, a serial killer is on the loose--and only John knows it.",Jennifer 8,1992,0104549,Jennifer-Eight_dialogue.txt,Jennifer-Eight_charinfo.txt,Jennifer-Eight_parsed.txt
541,jennifersbody,Jennifer's Body,imsdb,Jennifers-Body,https://imsdb.com/scripts/Jennifer%27s-Body.html,Jennifer's Body,2009-09-18,19994,"Jennifer, a gorgeous, seductive cheerleader takes evil to a whole new level after she's possessed by a sinister demon. Now it's up to her best friend to stop Jennifer's reign of terror before it's too late.",Jennifer's Body,2009,1131734,Jennifers-Body_dialogue.txt,Jennifers-Body_charinfo.txt,Jennifers-Body_parsed.txt
