id,movie_key,name,source,file_name,script_url,tmdb_title,release_date,tmdb_id,overview,imdb_title,imdb_release_date,imdb_id,dialogue,charinfo,tagged
792,reader,"Reader, The",imsdb,Reader-The,https://imsdb.com/scripts/Reader%2C-The.html,The Reader,2008-12-10,8055,"The story of Michael Berg, a German lawyer who, as a teenager in the late 1950s, had an affair with an older woman, Hanna, who then disappeared only to resurface years later as one of the defendants in a war crimes trial stemming from her actions as a concentration camp guard late in the war. He alone realizes that Hanna is illiterate and may be concealing that fact at the expense of her freedom.",The Reader,2008,0976051,Reader-The_dialogue.txt,Reader-The_charinfo.txt,Reader-The_parsed.txt
793,rearwindow,Rear Window,imsdb,Rear-Window,https://imsdb.com/scripts/Rear-Window.html,Rear Window,1954-08-01,567,A wheelchair-bound photographer spies on his neighbors from his apartment window and becomes convinced one of them has committed murder.,Rear Window,1954,0047396,Rear-Window_dialogue.txt,Rear-Window_charinfo.txt,Rear-Window_parsed.txt
794,rebelwithoutcause,Rebel Without A Cause,imsdb,Rebel-Without-A-Cause,https://imsdb.com/scripts/Rebel-Without-A-Cause.html,Rebel Without a Cause,1955-10-27,221,"After moving to a new town, troublemaking teen Jim Stark is supposed to have a clean slate, although being the new kid in town brings its own problems. While searching for some stability, Stark forms a bond with a disturbed classmate, Plato, and falls for local girl Judy. However, Judy is the girlfriend of neighborhood tough, Buzz. When Buzz violently confronts Jim and challenges him to a drag race, the new kid's real troubles begin.",Rebel Without a Cause,1955,0048545,Rebel-Without-A-Cause_dialogue.txt,Rebel-Without-A-Cause_charinfo.txt,Rebel-Without-A-Cause_parsed.txt
795,redridinghood,Red Riding Hood,imsdb,Red-Riding-Hood,https://imsdb.com/scripts/Red-Riding-Hood.html,Red Riding Hood,2011-03-10,49730,"Valerie is in love with a brooding outsider, Peter, but her parents have arranged for her to marry another man. Unwilling to lose each other, Valerie and Peter plan to run away together when Valerie's older sister is killed by a werewolf that prowls the dark forest surrounding their village. Panic grips the town as Valerie discovers that she has a unique connection to the beast--one that inexorably draws them together, making her both suspect...and bait",Red Riding Hood,2011,1486185,Red-Riding-Hood_dialogue.txt,Red-Riding-Hood_charinfo.txt,Red-Riding-Hood_parsed.txt
796,reindeergames,Reindeer Games,imsdb,Reindeer-Games,https://imsdb.com/scripts/Reindeer-Games.html,Reindeer Games,2000-02-25,2155,"After assuming his dead cellmate's identity to get with his girlfriend, an ex-con finds himself the reluctant participant in a casino heist.",Reindeer Games,2000,0184858,Reindeer-Games_dialogue.txt,Reindeer-Games_charinfo.txt,Reindeer-Games_parsed.txt
797,relic,"Relic, The",imsdb,Relic-The,https://imsdb.com/scripts/Relic%2C-The.html,The Relic,1997-01-10,11015,A homicide detective teams up with an evolutionary biologist to hunt a giant creature that is killing people in a Chicago museum.,The Relic,1997,0120004,Relic-The_dialogue.txt,Relic-The_charinfo.txt,Relic-The_parsed.txt
798,rememberme,Remember Me,imsdb,Remember-Me,https://imsdb.com/scripts/Remember-Me.html,Remember Me,2010-03-11,23169,"Still reeling from a heartbreaking family event and his parents' subsequent divorce, Tyler Hawkins discovers a fresh lease on life when he meets Ally Craig, a gregarious beauty who witnessed her mother's death. But as the couple draws closer, the fallout from their separate tragedies jeopardizes their love.",Remember Me,2010,1403981,Remember-Me_dialogue.txt,Remember-Me_charinfo.txt,Remember-Me_parsed.txt
799,replacements,"Replacements, The",imsdb,Replacements-The,https://imsdb.com/scripts/Replacements%2C-The.html,The Replacements,2000-08-11,10393,"Maverick old-guard coach Jimmy McGinty is hired in the wake of a players' strike to help the Washington Sentinels advance to the playoffs. But that impossible dream hinges on whether his replacements can hunker down and do the job. So, McGinty dusts off his secret dossier of ex-players who never got a chance (or screwed up the one they were given) and knits together a bad-dream team of guys who just may give the Sentinels their title shot.",The Replacements,2000,0191397,Replacements-The_dialogue.txt,Replacements-The_charinfo.txt,Replacements-The_parsed.txt
800,repoman,Repo Man,imsdb,Repo-Man,https://imsdb.com/scripts/Repo-Man.html,Repo Man,1984-02-20,13820,"A down and out young punk gets a job working with a seasoned repo man, but what awaits him in his new career is a series of outlandish adventures revolving around aliens, the CIA, and a most wanted '64 Chevy.",Repo Man,1984,0087995,Repo-Man_dialogue.txt,Repo-Man_charinfo.txt,Repo-Man_parsed.txt
801,rescuersdownunder,"Rescuers Down Under, The",imsdb,Rescuers-Down-Under-The,https://imsdb.com/scripts/Rescuers-Down-Under%2C-The.html,The Rescuers Down Under,1990-11-16,11135,"A lawless poacher wants to capture a majestic and rare golden eagle, so he kidnaps the boy who knows where to find the bird. Not to worry -- the Rescue Aid Society's top agents, heroic mice Miss Bianca and Bernard, fly to Australia to save the day. Accompanying the fearless duo are bumbling albatross Wilbur and local field operative Jake the Kangaroo Rat.",The Rescuers Down Under,1990,0100477,NA,NA,NA
802,reservoirdogs,Reservoir Dogs,imsdb,Reservoir-Dogs,https://imsdb.com/scripts/Reservoir-Dogs.html,Reservoir Dogs,1992-09-02,500,"A botched robbery indicates a police informant, and the pressure mounts in the aftermath at a warehouse. Crime begets violence as the survivors -- veteran Mr. White, newcomer Mr. Orange, psychopathic parolee Mr. Blonde, bickering weasel Mr. Pink and Nice Guy Eddie -- unravel.",Reservoir Dogs,1992,0105236,Reservoir-Dogs_dialogue.txt,Reservoir-Dogs_charinfo.txt,Reservoir-Dogs_parsed.txt
803,revenant,"Revenant, The",imsdb,Revenant-The,https://imsdb.com/scripts/Revenant%2C-The.html,The Revenant,2015-12-25,281957,"In the 1820s, a frontiersman, Hugh Glass, sets out on a path of vengeance against those who left him for dead after a bear mauling.",The Revenant,2015,1663202,Revenant-The_dialogue.txt,Revenant-The_charinfo.txt,Revenant-The_parsed.txt
804,revolutionaryroad,Revolutionary Road,imsdb,Revolutionary-Road,https://imsdb.com/scripts/Revolutionary-Road.html,Revolutionary Road,2008-12-19,4148,A young couple living in a Connecticut suburb during the mid-1950s struggle to come to terms with their personal problems while trying to raise their two children. Based on a novel by Richard Yates.,Revolutionary Road,2008,0959337,Revolutionary-Road_dialogue.txt,Revolutionary-Road_charinfo.txt,Revolutionary-Road_parsed.txt
805,ringu,Ringu,imsdb,Ringu,https://imsdb.com/scripts/Ringu.html,Ring,1998-01-31,2671,"A mysterious video has been linked to a number of deaths, and when an inquisitive journalist finds the tape and views it herself, she sets in motion a chain of events that puts her own life in danger.",Ringu,1998,0178868,Ringu_dialogue.txt,Ringu_charinfo.txt,Ringu_parsed.txt
806,riseofguardians,Rise of the Guardians,imsdb,Rise-of-the-Guardians,https://imsdb.com/scripts/Rise-of-the-Guardians.html,Rise of the Guardians,2012-11-21,81188,"When an evil spirit known as Pitch lays down the gauntlet to take over the world, the immortal Guardians must join forces for the first time to protect the hopes, beliefs and imagination of children all over the world.",Rise of the Guardians,2012,1446192,Rise-of-the-Guardians_dialogue.txt,Rise-of-the-Guardians_charinfo.txt,Rise-of-the-Guardians_parsed.txt
807,riseofplanetofapes,Rise of the Planet of the Apes,imsdb,Rise-of-the-Planet-of-the-Apes,https://imsdb.com/scripts/Rise-of-the-Planet-of-the-Apes.html,Rise of the Planet of the Apes,2011-08-03,61791,"A highly intelligent chimpanzee named Caesar has been living a peaceful suburban life ever since he was born. But when he gets taken to a cruel primate facility, Caesar decides to revolt against those who have harmed him.",Rise of the Planet of the Apes,2011,1318514,Rise-of-the-Planet-of-the-Apes_dialogue.txt,Rise-of-the-Planet-of-the-Apes_charinfo.txt,Rise-of-the-Planet-of-the-Apes_parsed.txt
808,rko281,RKO 281,imsdb,RKO-281,https://imsdb.com/scripts/RKO-281.html,RKO 281,2000-04-07,50008,"In 1939, boy-wonder Orson Welles leaves New York, where he has succeeded in radio and theater, and, hired by RKO Pictures, moves to Hollywood with the purpose of making his first film.",RKO 281,1999,0120801,RKO-281_dialogue.txt,RKO-281_charinfo.txt,RKO-281_parsed.txt
809,road,"Road, The",imsdb,Road-The,https://imsdb.com/scripts/Road%2C-The.html,The Road,2009-11-25,20766,"A father and his son walk alone through burned America. Nothing moves in the ravaged landscape save the ash on the wind and water. It is cold enough to crack stones, and, when the snow falls it is gray. The sky is dark. Their destination is the warmer south, although they don't know what, if anything, awaits them there.",The Road,2009,0898367,Road-The_dialogue.txt,Road-The_charinfo.txt,Road-The_parsed.txt
810,robinhoodprinceofthieves,Robin Hood: Prince of Thieves,imsdb,Robin-Hood-Prince-of-Thieves,https://imsdb.com/scripts/Robin-Hood-Prince-of-Thieves.html,Robin Hood: Prince of Thieves,1991-06-14,8367,"When the dastardly Sheriff of Nottingham murders Robin's father, the legendary archer vows vengeance. To accomplish his mission, Robin joins forces with a band of exiled villagers (and comely Maid Marian), and together they battle to end the evil sheriff's reign of terror.",Robin Hood: Prince of Thieves,1991,0102798,Robin-Hood-Prince-of-Thieves_dialogue.txt,Robin-Hood-Prince-of-Thieves_charinfo.txt,Robin-Hood-Prince-of-Thieves_parsed.txt
811,rock,"Rock, The",imsdb,Rock-The,https://imsdb.com/scripts/Rock%2C-The.html,The Rock,1996-06-07,9802,"When vengeful General Francis X. Hummel seizes control of Alcatraz Island and threatens to launch missiles loaded with deadly chemical weapons into San Francisco, only a young FBI chemical weapons expert and notorious Federal prisoner have the stills to penetrate the impregnable island fortress and take him down.",The Rock,1996,0117500,Rock-The_dialogue.txt,Rock-The_charinfo.txt,Rock-The_parsed.txt
812,rocknrolla,RocknRolla,imsdb,RocknRolla,https://imsdb.com/scripts/RocknRolla.html,RocknRolla,2008-09-04,13809,"When a Russian mobster sets up a real estate scam that generates millions of pounds, various members of London's criminal underworld pursue their share of the fortune. Various shady characters, including Mr One-Two, Stella the accountant, and Johnny Quid, a druggie rock-star, try to claim their slice.",RocknRolla,2008,1032755,RocknRolla_dialogue.txt,RocknRolla_charinfo.txt,RocknRolla_parsed.txt
813,rocky,Rocky,imsdb,Rocky,https://imsdb.com/scripts/Rocky.html,Rocky,1976-11-21,1366,An uneducated collector for a Philadelphia loan shark is given a once-in-a-lifetime opportunity to fight against the world heavyweight boxing champion.,Rocky,1976,0075148,Rocky_dialogue.txt,Rocky_charinfo.txt,Rocky_parsed.txt
814,rockyhorrorpictureshow,"Rocky Horror Picture Show, The",imsdb,Rocky-Horror-Picture-Show-The,https://imsdb.com/scripts/Rocky-Horror-Picture-Show%2C-The.html,The Rocky Horror Picture Show,1975-08-14,36685,"Sweethearts Brad and Janet, stuck with a flat tire during a storm, discover the eerie mansion of Dr. Frank-N-Furter, a transvestite scientist. As their innocence is lost, Brad and Janet meet a houseful of wild characters, including a rocking biker and a creepy butler. Through elaborate dances and rock songs, Frank-N-Furter unveils his latest creation: a muscular man named 'Rocky'. Harriet then spawns in and says hello and the credits roll!",The Rocky Horror Picture Show,1975,0073629,Rocky-Horror-Picture-Show-The_dialogue.txt,Rocky-Horror-Picture-Show-The_charinfo.txt,Rocky-Horror-Picture-Show-The_parsed.txt
815,ronin,Ronin,imsdb,Ronin,https://imsdb.com/scripts/Ronin.html,Ronin,1998-09-25,8195,"A briefcase with undisclosed contents - sought by Irish terrorists and the Russian mob - makes its way into criminals' hands. An Irish liaison assembles a squad of mercenaries, or 'ronin', and gives them the thorny task of recovering the case.",Ronin,1998,0122690,Ronin_dialogue.txt,Ronin_charinfo.txt,Ronin_parsed.txt
816,room,Room,imsdb,Room,https://imsdb.com/scripts/Room.html,Room,2015-10-16,264644,"Held captive for 7 years in an enclosed space, a woman and her young son finally gain their freedom, allowing the boy to experience the outside world for the first time.",Room,2015,3170832,Room_dialogue.txt,Room_charinfo.txt,Room_parsed.txt
817,roommate,"Roommate, The",imsdb,Roommate-The,https://imsdb.com/scripts/Roommate%2C-The.html,The Roommate,2024-01-18,1229913,"Vivi is a young writer who is forced to find a roommate to pay the mortgage on her apartment. What she does not suspect is that Roy, the supposed perfect partner she found, has a peculiar lifestyle: he never pays rent.",The Roommate,2011,1265990,Roommate-The_dialogue.txt,Roommate-The_charinfo.txt,Roommate-The_parsed.txt
818,roughshod,Roughshod,imsdb,Roughshod,https://imsdb.com/scripts/Roughshod.html,Roughshod,1949-05-11,126374,"Rancher Clay and his brother, Steve, head out across the Sonora mountain pass, followed by Lednov, an ex-con seeking revenge on Clay for putting him behind bars. Clay and Steve unexpectedly cross paths with a group of dance hall girls -- including Mary, Marcia and Helen -- whose stagecoach has broken down, and help them get to the nearest ranch, where Lednov unfortunately catches up to Clay.",Roughshod,1949,0041827,Roughshod_dialogue.txt,Roughshod_charinfo.txt,Roughshod_parsed.txt
819,ruins,"Ruins, The",imsdb,Ruins-The,https://imsdb.com/scripts/Ruins%2C-The.html,The Ruins,2008-04-02,11152,"Americans Amy, Stacy, Jeff and Eric look for fun during a sunny holiday in Mexico, but they get much more than that after visiting an archaeological dig in the jungle.",The Ruins,2008,0963794,Ruins-The_dialogue.txt,Ruins-The_charinfo.txt,Ruins-The_parsed.txt
820,runawaybride,Runaway Bride,imsdb,Runaway-Bride,https://imsdb.com/scripts/Runaway-Bride.html,Runaway Bride,1999-07-30,4806,"Having already left three grooms at the altar, Maggie Carpenter is branded ""the runaway bride"" by jaded New York journalist Ike Graham. But, after his facts are called into question, Ike races to Maggie's hometown to save his reputation and report on her upcoming fourth trip down the aisle - during which he's convinced she'll run again. Though he's there on a muckraking mission, Ike can't help but fall for this breathtaking heartbreaker.",Runaway Bride,1999,0163187,Runaway-Bride_dialogue.txt,Runaway-Bride_charinfo.txt,Runaway-Bride_parsed.txt
821,rush,Rush,imsdb,Rush,https://imsdb.com/scripts/Rush.html,Rush,2013-09-02,96721,"In the 1970s, a rivalry propels race car drivers Niki Lauda and James Hunt to fame and glory -- until a horrible accident threatens to end it all.",Rush,2013,1979320,Rush_dialogue.txt,Rush_charinfo.txt,Rush_parsed.txt
822,rushhour,Rush Hour,imsdb,Rush-Hour,https://imsdb.com/scripts/Rush-Hour.html,Rush Hour,1998-09-18,2109,"When Hong Kong Inspector Lee is summoned to Los Angeles to investigate a kidnapping, the FBI doesn't want any outside help and assigns cocky LAPD Detective James Carter to distract Lee from the case. Not content to watch the action from the sidelines, Lee and Carter form an unlikely partnership and investigate the case themselves.",Rush Hour,1998,0120812,Rush-Hour_dialogue.txt,Rush-Hour_charinfo.txt,Rush-Hour_parsed.txt
823,rushhour2,Rush Hour 2,imsdb,Rush-Hour-2,https://imsdb.com/scripts/Rush-Hour-2.html,Rush Hour 2,2001-08-03,5175,"It's vacation time for Carter as he finds himself alongside Lee in Hong Kong wishing for more excitement. While Carter wants to party and meet the ladies, Lee is out to track down a Triad gang lord who may be responsible for killing two men at the American Embassy. Things get complicated as the pair stumble onto a counterfeiting plot. The boys are soon up to their necks in fist fights and life-threatening situations. A trip back to the U.S. may provide the answers about the bombing, the counterfeiting, and the true allegiance of sexy customs agent Isabella.",Rush Hour 2,2001,0266915,Rush-Hour-2_dialogue.txt,Rush-Hour-2_charinfo.txt,Rush-Hour-2_parsed.txt
824,rustbone,Rust and Bone,imsdb,Rust-and-Bone,https://imsdb.com/scripts/Rust-and-Bone.html,Rust and Bone,2012-05-17,97365,"Put in charge of his young son, Ali leaves Belgium for Antibes to live with his sister and her husband as a family. Ali's bond with Stephanie, a killer whale trainer, grows deeper after Stephanie suffers a horrible accident.",Rust and Bone,2012,2053425,Rust-and-Bone_dialogue.txt,Rust-and-Bone_charinfo.txt,Rust-and-Bone_parsed.txt
825,sdarko,S. Darko,imsdb,S-Darko,https://imsdb.com/scripts/S.-Darko.html,S. Darko,2009-04-28,17532,"Seven years after the events of the first film, Samantha Darko finds herself stranded in a small desert town after her car breaks down where she is plagued by bizarre visions telling of the universe's end. As a result, she must face her own demons, and in doing so, save the world and herself.",S. Darko,2009,1231277,S-Darko_dialogue.txt,S-Darko_charinfo.txt,S-Darko_parsed.txt
826,saltonsea,"Salton Sea, The",imsdb,Salton-Sea-The,https://imsdb.com/scripts/Salton-Sea%2C-The.html,The Salton Sea,2002-02-02,11468,"After the murder of his beloved wife, a man in search of redemption is set adrift in a world where nothing is as it seems. On his journey, he befriends slacker Jimmy ""The Finn"", becomes involved in rescuing his neighbor Colette from her own demons, and gets entangled in a web of deceit full of unexpected twists and turns.",The Salton Sea,2002,0235737,Salton-Sea-The_dialogue.txt,Salton-Sea-The_charinfo.txt,Salton-Sea-The_parsed.txt
827,sandlotkids,"Sandlot Kids, The",imsdb,Sandlot-Kids-The,https://imsdb.com/scripts/Sandlot-Kids%2C-The.html,The Sandlot,1993-04-07,11528,"During a summer of friendship and adventure, one boy becomes a part of the gang, nine boys become a team and their leader becomes a legend by confronting the terrifying mystery beyond the right field wall.",The Sandlot,1993,0108037,Sandlot-Kids-The_dialogue.txt,Sandlot-Kids-The_charinfo.txt,Sandlot-Kids-The_parsed.txt
828,savelastdance,Save the Last Dance,imsdb,Save-the-Last-Dance,https://imsdb.com/scripts/Save-the-Last-Dance.html,Save the Last Dance,2001-01-12,9816,"After the death of her mother, Sara moves to the South Side of Chicago to live with her father and gets transferred to a majority-black school. Her life takes a turn for the better when befriends Chenille and her brother Derek, who helps her with her dancing skills.",Save the Last Dance,2001,0206275,Save-the-Last-Dance_dialogue.txt,Save-the-Last-Dance_charinfo.txt,Save-the-Last-Dance_parsed.txt
829,savingmrbanks,Saving Mr. Banks,imsdb,Saving-Mr-Banks,https://imsdb.com/scripts/Saving-Mr.-Banks.html,Saving Mr. Banks,2013-11-29,140823,"Author P.L. Travers looks back on her childhood while reluctantly meeting with Walt Disney, who seeks to adapt her Mary Poppins books for the big screen.",Saving Mr. Banks,2013,2140373,Saving-Mr-Banks_dialogue.txt,Saving-Mr-Banks_charinfo.txt,Saving-Mr-Banks_parsed.txt
830,savingprivateryan,Saving Private Ryan,imsdb,Saving-Private-Ryan,https://imsdb.com/scripts/Saving-Private-Ryan.html,Saving Private Ryan,1998-07-24,857,"As U.S. troops storm the beaches of Normandy, three brothers lie dead on the battlefield, with a fourth trapped behind enemy lines. Ranger captain John Miller and seven men are tasked with penetrating German-held territory and bringing the boy home.",Saving Private Ryan,1998,0120815,Saving-Private-Ryan_dialogue.txt,Saving-Private-Ryan_charinfo.txt,Saving-Private-Ryan_parsed.txt
831,saw,Saw,imsdb,Saw,https://imsdb.com/scripts/Saw.html,Saw,2004-10-01,176,"Two men wake up to find themselves shackled in a grimy, abandoned bathroom. As they struggle to comprehend their predicament, they discover a disturbing tape left behind by the sadistic mastermind known as Jigsaw. With a chilling voice and cryptic instructions, Jigsaw informs them that they must partake in a gruesome game in order to secure their freedom.",Saw,2004,0387564,Saw_dialogue.txt,Saw_charinfo.txt,Saw_parsed.txt
832,scarface,Scarface,imsdb,Scarface,https://imsdb.com/scripts/Scarface.html,Scarface,1983-12-09,111,"After getting a green card in exchange for assassinating a Cuban government official, Tony Montana stakes a claim on the drug trade in Miami. Viciously murdering anyone who stands in his way, Tony eventually becomes the biggest drug lord in the state, controlling nearly all the cocaine that comes through Miami. But increased pressure from the police, wars with Colombian drug cartels and his own drug-fueled paranoia serve to fuel the flames of his eventual downfall.",Scarface,1983,0086250,Scarface_dialogue.txt,Scarface_charinfo.txt,Scarface_parsed.txt
833,schindlerslist,Schindler's List,imsdb,Schindlers-List,https://imsdb.com/scripts/Schindler%27s-List.html,Schindler's List,1993-12-15,424,The true story of how businessman Oskar Schindler saved over a thousand Jewish lives from the Nazis while they worked as slaves in his factory during World War II.,Schindler's List,1993,0108052,Schindlers-List_dialogue.txt,Schindlers-List_charinfo.txt,Schindlers-List_parsed.txt
834,scottpilgrimvsworld,Scott Pilgrim vs the World,imsdb,Scott-Pilgrim-vs-the-World,https://imsdb.com/scripts/Scott-Pilgrim-vs-the-World.html,Scott Pilgrim vs. the World,2010-08-12,22538,"As bass guitarist for a garage-rock band, Scott Pilgrim has never had trouble getting a girlfriend; usually, the problem is getting rid of them. But when Ramona Flowers skates into his heart, he finds she has the most troublesome baggage of all: an army of ex-boyfriends who will stop at nothing to eliminate him from her list of suitors.",Scott Pilgrim vs. the World,2010,0446029,Scott-Pilgrim-vs-the-World_dialogue.txt,Scott-Pilgrim-vs-the-World_charinfo.txt,Scott-Pilgrim-vs-the-World_parsed.txt
835,scream,Scream,imsdb,Scream,https://imsdb.com/scripts/Scream.html,Scream,2022-01-12,646385,"Twenty-five years after a streak of brutal murders shocked the quiet town of Woodsboro, a new killer has donned the Ghostface mask and begins targeting a group of teenagers to resurrect secrets from the town's deadly past.",Scream,1996,0117571,Scream_dialogue.txt,Scream_charinfo.txt,Scream_parsed.txt
836,scream2,Scream 2,imsdb,Scream-2,https://imsdb.com/scripts/Scream-2.html,Scream 2,1997-12-12,4233,"Away at college, Sidney Prescott thought she'd finally put the shocking murders that shattered her life behind her... until a copycat killer begins acting out a real-life sequel.",Scream 2,1997,0120082,Scream-2_dialogue.txt,Scream-2_charinfo.txt,Scream-2_parsed.txt
837,scream3,Scream 3,imsdb,Scream-3,https://imsdb.com/scripts/Scream-3.html,Scream 3,2000-02-04,4234,"While Sidney Prescott lives in safely guarded seclusion, bodies begin dropping around the Hollywood set of STAB 3, the latest movie based on the gruesome Woodsboro killings.",Scream 3,2000,0134084,Scream-3_dialogue.txt,Scream-3_charinfo.txt,Scream-3_parsed.txt
838,scream4,Scream 4,imsdb,Scream-4,https://imsdb.com/scripts/Scream-4.html,Scream 4,2011-04-13,41446,"Sidney Prescott, now the author of a self-help book, returns home to Woodsboro on the last stop of her book tour, which brings about the return of Ghostface, putting her friends, family, and the whole town in danger.",Scream 4,2011,1262416,Scream-4_dialogue.txt,Scream-4_charinfo.txt,Scream-4_parsed.txt
839,se7en,Se7en,imsdb,Se7en,https://imsdb.com/scripts/Se7en.html,Se7en,1995-09-22,807,"Two homicide detectives are on a desperate hunt for a serial killer whose crimes are based on the ""seven deadly sins"" in this dark and haunting film that takes viewers from the tortured remains of one victim to the next. The seasoned Det. Sommerset researches each sin in an effort to get inside the killer's mind, while his novice partner, Mills, scoffs at his efforts to unravel the case.",Se7en,1995,0114369,Se7en_dialogue.txt,Se7en_charinfo.txt,Se7en_parsed.txt
840,searchers,"Searchers, The",imsdb,Searchers-The,https://imsdb.com/scripts/Searchers%2C-The.html,The Searchers,1956-05-16,3114,"As a Civil War veteran spends years searching for a young niece captured by Indians, his motivation becomes increasingly questionable.",The Searchers,1956,0049730,Searchers-The_dialogue.txt,Searchers-The_charinfo.txt,Searchers-The_parsed.txt
841,secretlifeofwaltermitty,"Secret Life of Walter Mitty, The",imsdb,Secret-Life-of-Walter-Mitty-The,https://imsdb.com/scripts/Secret-Life-of-Walter-Mitty%2C-The.html,The Secret Life of Walter Mitty,2013-12-18,116745,A timid magazine photo manager who lives life vicariously through daydreams embarks on a true-life adventure when a negative goes missing.,The Secret Life of Walter Mitty,2013,0359950,Secret-Life-of-Walter-Mitty-The_dialogue.txt,Secret-Life-of-Walter-Mitty-The_charinfo.txt,Secret-Life-of-Walter-Mitty-The_parsed.txt
842,semipro,Semi-Pro,imsdb,Semi-Pro,https://imsdb.com/scripts/Semi-Pro.html,Semi-Pro,2008-02-28,13260,"Jackie Moon is the owner, promoter, coach, and star player of the Flint Michigan Tropics of the American Basketball Association (ABA), the worst team in the league. In 1976 before the ABA collapses, the NBA plans to merge with the best teams of the ABA at the end of the season. Only the top four teams will make the move and the worst teams will fold. If the Tropics want to make it to the NBA, Jackie Moon must rally his team and start winning.",Semi-Pro,2008,0839980,Semi-Pro_dialogue.txt,Semi-Pro_charinfo.txt,Semi-Pro_parsed.txt
